authors,content,doc_id,note
Fabrice Sorin,"What is it you are doing again? Circular Economy? Ah yes, yes, you work in recycling right?  I get that a lot...  For a long time the Circular Economy has been promoted, and understood, as “recycling on steroïds”, whilst the concept of a #circulareconomy  is the opposite of recycling.   Recycling is not even the right term, we should talk about ‘downcycling’  Why? Because recycling implies the degradation of the physical properties of products and materials, important energy inputs and demand a heavy infrastructure to collect, process, transform and ‘downcycle’ materials.  Are you getting confused? 2 good news for you   First, the European Union published an update of the #europeangreendeal  and the European Circular Economy action plan. It is (finally) quite ambitious.  “the Commission is presenting the tools to move to a truly Circular Economy in the EU: decoupled from energy- and resource dependencies, more resilient to external shocks and respectful of nature and people's health.”  The plan will have particular focus on: sustainable and circular textiles construction industry regulations for product eco-design  extended producer responsibility digital product passport  The terminology of the EU wide Circular Economy framework is also evolving to explicitly mention the requirement for ‘sobriety in resource use’, ‘resiliency of economic and social activities AND “economic activities respecting planetary boundaries”   Yes, you’ve read that right…sobriety, planetary boundaries…  We are moving away from re/downcycling into a rethinking, a redesign of economic activities across industries that integrate the notion of ‘consume less, consume better’ articulated by the concept of a Circular Economy regenerative of natural and social systems.   Second, and linked to the EU latest announcement, there are more and more initiatives, #projects, #innovations embedding Circular Economy principles emerging and scaling in the EU in various industries from construction to textile, tech. and even services.   There is still a long road (and massive business opportunities) ahead, but you have to start somewhere don’t you?  To accelerate this Circular Economy transformation, we have published a #freeonlinecourse for professionals of all backgrounds and industries to learn about the Circular Economy transformative potential for businesses and societies.  If you want to know more and register for this free course, check the link in the comment.         ",507,1.0
Mathilde TENENT," SHARE MY POST PLEASE  ((version FR en commentaire))  _____________________________   Dear Network,  Dear Ms,  Dear Sir,    Please don't pass by, I only ask for a few minutes of your attention   How about an industry that makes eco-designed products?  An industry that releases very little to no CO2 emissions and guarantees a healthy living environment for all?  All this seems impossible to you? The word ""impossible"" is not in my vocabulary, this is the challenge I want to take up!   Currently a general engineer student at CESI in Bordeaux (France), I pay particular attention to current global issues and I am convinced that our society, in constant evolution, needs innovation to meet its growing needs. That's why I am very sensitive to the development we could bring to today's and tomorrow's generations in order to live in a better world!    As part of my training, I have the chance and opportunity to do an internship abroad from September which will allow me to discover new aspects of the engineering profession and to familiarize myself with the English language.   Besides the professional side, I am looking forward to getting to know a new country, a new culture and to meet new people.     When ? 19th September 2022 to 27th January 2023. Where ? In an English speaking country (England, Scotland, Wales, Ireland, USA, Canada, Australia, New Zealand, Malta, South Africa, Finland, Norway,...)  In what type of company? An industry   In what field of activity? It doesn't matter (automotive, aerospace, medical, food processing, cosmetics, textile, construction, ...)    In which field? Environmental, sustainable development also known as the Health, Safety and Environment (HSE) field.  My role? To study and optimize the life cycle of products, to limit their carbon impact by implementing means of accounting for emissions, action and prevention plans, control, communication, and awareness. All this while promoting, at most, renewable energies and eco-design.   Maybe you will be able to help me in this great quest and will be part of the people who will contribute to my career path!    Thank you for your time and consideration.   Reachable by phone at +33 632685974 or by email at mathild.tenent@gmail.com    Many thanks,  TENENT Mathilde   #safety #environment #environmental #abroad #engineering #internship #engineer #sustainabledevelopment #skills #motivate #responsability #projectmanagement ",508,4.0
Yulia Plakhotnyuk,"#sustainability is relevant for all sectors including travel retail. This ecoresponsable concept open by Lagardère Travel Retail in Geneva Airport looks very relevant today.  I’ve been always mindful of POSM reusing and recycling. Unfortunately in the reality the scale of waste in this are has been enormous. Such concept is a big step towards retail sustainability.   « The retailer said it aims to achieve a -40% reduction in the carbon footprint of furniture and POS materials. To do this it has partnered with MEDIA 6, a specialised French manufacturer which developed the Eco-logic carbon calculator. This tool has been used to set tangible emissions targets for the pilot store.  A life-cycle assessment based on the 3Rs (Reduce/Re-Use/Recycle) approach to tackle resource efficiency and waste management has driven the eco-design of the store. »   Today it’s still difficult to imagine visual merchandising of some product categories without LED, and I am curious to see how sustainable visual merchandising and store design trend will evolve across the categories.   #retail #travelretail #posm #visualmerchandising #storedesign ",510,3.0
Raj Kharel,"While working on research for a Dior niche marketing plan, I came to appreciate the effort that went into multiple Dior campaigns to symbolize the fashion brand's approach to sustainability with eco-design on their product. Highlighting the Haute Couture Spring 2021 camping, the horse represents the environmental issue, and the lady petting the white horse represents the brand's concern for the environment. Haute Couture is a design that is handcrafted from start to finish in order to cause the least amount of environmental damage. According to Dior, the concept of eco-design efforts extends to all of its boutiques, which are designed with a minimum environmental impact in mind. #marketing #sustainability #environmental #brand #fashion ",525,4.0
Paris Packaging Week,CPI is carrying out a new project for L'Occitane: a new kind of refill for Ultra Rich Body Cream Shea. L'Occitane products are designed according to eco-design principles and the Ultra Rich Body Cream Shea refill further minimises its environmental impact. It is a recharge in a material of PP 100% PCR (post-consumer recycled).  Find out more at News Packaging Magazine: https://bit.ly/37LUu0v #packaging #packagingdesign #loccitane #refillable #recycling #beauty ,526,4.0
Juan Domingo Merino Pacheco,"From the choice of the paper, to the font, the print technique, the type of ink or even the size of printed materials, designers and printers are increasingly aware of their environmental impact. In order to educate and inspire around eco-design and eco-print, this category aims at showcasing projects designed with sustainability in mind.  Whether you have used carbon neutral papers, such as Olin Paper Origins or Pergraphica, upcycled papers (Refit from Favini) or recycled creative papers (such as those from Arjowiggins) or chosen #craddletocraddle certified papers (like those from Munken Paper), or selected Cocoon or Cyclus, we invite you to share your projects with us!  To discover more about the competition and its many prizes or to submit a project, visit http://ow.ly/FkoB103yJx3  Video by Maud Vantours on Curious Metallics from Arjowiggins  #AntalisCreativePowerAwards2022 #ACPA2022 ",527,4.0
Project LIFE - Force of the Future - Forture,"It is almost a year since the end of the LIFE Forture project but the dissemination activity continues.   The project team continues to publish project results in leading academic journals. These publications also describe the new research topics the team is tackling in this after LIFE phase. This is the list of the latest publications made by the team:   Social Organizational Life Cycle Assessment (SO-LCA) and Organization 4.0: an easy-to-implement method   Building Exploitation Routines in the Circular Supply Chain to Obtain Radical Innovations   Life cycle costing as a way to include economic sustainability in the circular economy. New perspectives from resource-intensive industries   Industry 4.0 and Smart Data as Enablers of the Circular Economy in Manufacturing: Product Re-Engineering with Circular Eco-Design   Are you curious to read these papers? Our news section has all the links: https://lnkd.in/eq9KZAb6   Project partners: Gruppo Ceramiche Gresmalt, Universidad Rey Juan Carlos, Università degli Studi di Modena e Reggio Emilia LIFE Programme, Elsevier, Sustainability MDPI, Resources Basel MDPI  #sustainability #research #team #lifeproject #lifeprogramme #manufacturing ",528,2.0
CleanChain,"The European Commission is calling for an end to #fastfashion by 2030, as it announced a vast expansion of eco-design rules that could in future apply to any product, starting with #textiles. https://buff.ly/3jbLHHT #Brands and #Suppliers can easily stay up-to-date with the latest regulations and legal obligations with CleanChain #Compliance, learn more: https://buff.ly/3uIhoj0 ",529,4.0
Francesca P.,"Long-lasting design and conscious consumption are our guiding principles on our path towards a sustainable future. As part of the Hansgrohe Group, we have defined, and are committed to ten Eco-Design principles by which we want to develop, design and manufacture our AXOR products in the future. Learn more about the first five principles here and stay tuned for the second part tomorrow.  #AXORFutures #sustainability #responsibility ",530,4.0
Grænni byggð - Green Building Council Iceland,"*íslenska neðst*  𝗧𝗵𝗲 𝗖𝗜𝗥𝗖𝗢𝗡 𝗽𝗿𝗼𝗷𝗲𝗰𝘁 𝗵𝗮𝘀 𝗹𝗮𝘂𝗻𝗰𝗵𝗲𝗱 𝗳𝗼𝗿 𝗴𝗼𝗼𝗱!  The project is on the CIRcular economy in CONstruction with a particular emphasis on the eco-design of circular buildings.    Yesterday, we had a kick-off meeting with our partners from the Silesian University of Technology and PLGBC Polish Green Building Council . We discussed and planned, among others, rules of conduct within the project and our nearest activities.  More info is coming soon; follow us for the updates!  𝘚𝘶𝘱𝘱𝘰𝘳𝘵𝘦𝘥 𝘣𝘺 𝘐𝘤𝘦𝘭𝘢𝘯𝘥, 𝘓𝘪𝘦𝘤𝘩𝘵𝘦𝘯𝘴𝘵𝘦𝘪𝘯 𝘢𝘯𝘥 𝘕𝘰𝘳𝘸𝘢𝘺 𝘵𝘩𝘳𝘰𝘶𝘨𝘩 𝘵𝘩𝘦 𝘌𝘌𝘈 𝘢𝘯𝘥 𝘕𝘰𝘳𝘸𝘢𝘺 𝘎𝘳𝘢𝘯𝘵𝘴 𝘢𝘯𝘥 𝘤𝘰-𝘧𝘶𝘯𝘥𝘦𝘥 𝘣𝘺 𝘵𝘩𝘦 𝘯𝘢𝘵𝘪𝘰𝘯𝘢𝘭 𝘧𝘶𝘯𝘥𝘪𝘯𝘨 𝘰𝘧 𝘗𝘰𝘭𝘢𝘯𝘥. #gbciprojects #circon #circulareconomy #circularconstruction #greenbuildings  --------  CIRCON verkefnið er formlega hafið!  Verkefnið snýst um hringrásarhagkerfið í byggingariðnaði með sérstakri áherslu á vistvæna hönnun hringrásarbygginga.    Í gær var haldinn upphafsfundur með samstarfsaðilum okkar frá Silesian University of Technology og PLGBC. Við ræddum og skipulögðum meðal annars siðareglur innan verkefnisins og næstu skref.  Frekari upplýsingar koma fljótlega.  Verkefnið er stutt af Íslandi, Líktenstein, Póllandi og Noregi.         ",531,4.0
State Agency on Energy Efficiency and Energy Saving of Ukraine,"Ukraine is implementing EU experience and standards on eco-design and energy labeling  European consumers have saved more than 120 billion euros in 2021 thanks to the current requirements for eco-design and energy labeling of energy-related products. Savings are expected to exceed 250 billion euros in 2022.   Ukraine is also actively implementing European ecodesign and energy labeling requirements. For today Ukrainian Government has adopted: ● 27 technical regulations that set minimum energy efficiency requirements for energy-related products; ● 15 technical regulations for energy labelling of energy-related products.   All of these technical regulations have been developed by the State Agency on Energy Efficiency and Energy Saving of Ukraine.  To increase the number of energy efficient goods on the Ukrainian market, the Agency is developing a number of new technical regulations in accordance with Directive 2009/125/EU.   Find out more about EU further plans:  https://lnkd.in/dQ7CNa2v Valerii Bezus Energy Community Energy Commission Cabinet of Ministers of Ukraine #energyefficiency ",532,4.0
Piyada Saut,"Packaging designed according to the principles of eco-design, which use recycled, ecological and easy-to-dispose of materials: these are the choices that have allowed us to integrate sustainability into our packaging too         ",533,4.0
TreaSure - IndiaforSure,"European Union has identified the Textile Sector as a priority with policies such as the European Green Deal, the Circular Economy Action Plan, and the Industrial Strategy placing importance on the sector. The European Commission in 2021 has published a Roadmap for Sustainable Textiles for public consultation. The European Council has now proposed rules focused on responsible production and incorporating eco-design in textile products to promote circularity such as having a digital passport for products.   Newslink -  https://lnkd.in/g6s4FxdV INDIAN TEXPRENEURS FEDERATION (ITF) Prabhu Dhamodharan #business #businessnews #textileindustry #news #textiles #success #clothing #latestnews #businesstrendsfor2022 #textile #indiaforsure #stable #sustainability #sustainable #reliable #ethical #apparel #technology #economy #environment #greeneconomy #greenfuture #commerce #sustainability #sustainable #sustainabledevelopment #biodegradable #ecofriendly ",534,4.0
Christian Engene,"It is over 6 years ago I first joined, what had already started to take shape into, the innovation agency Above.se. The professional and personal growth I have experienced in the years at Above will be impossible to match. It has been a fantastic time, with the most brilliant people around, designing future experiences and products.  Thank you for everything   Now I am moving on to new things, but feel sure that the focus on sustainability will be carried on by Jonas Samrelius, who is by the way recruiting some very important roles for Above forward. Check them out!  https://lnkd.in/gKnP8bTs https://lnkd.in/gxTESs6s  From now on you can reach me as a freelancing eco-design and circular design strategist. More things are to come here, but I am already up and running on new exciting projects.  christian@remanufaktur.co ",546,4.0
eion.io,"(EN) How can we continue to promote creators of the visual arts while remaining faithful to our values and innovating? The French State validates all our innovation efforts by accepting our request for the Innovation Credit: ""eion offers superior technical performance, functionality, ergonomics or eco-design compared to products marketed by your competitors"".             ",547,4.0
Joel Armengol Pagès,"This week I have been in Torino for LEITAT, developing the #CLEANTEXproject, with the aim of promoting the uptake of a circular economy and eco-design concepts, and to develop the skills of students in textile engineering.  #circulareconomy #ecodesign #sustainability ",548,4.0
Jane Mossman,"Loving this hybrid eco-design innovation session hosted brilliantly by James Wright, Sustainable Ventures with our Better Futures+ businesses. Learning how to think about and brainstorm innovative Human Centred Design ideas for their potential net zero products and services. #netzero2030 #climatechange #sustainable #innovation ",549,4.0
ALVIC,"Today in Maderalia, the outstanding architect Héctor Ruiz Velázquez will give a talk regarding Eco-design, Sustainability and how to incorporate it in your projects, like our stand for the fair.  Don't miss out this incredible event today at 12:00h!         ",550,4.0
Coloplast Wound and Skin Care,"At Coloplast, we strive to address environmental challenges. Watch the video to learn how we incorporate eco-design principles when developing products.   Learn more about our sustainability strategy:   Coloplast Professional: https://lnkd.in/exfGCNUi  Corporate page: https://lnkd.in/euZAve83 #sustainability #Strive25 #coloplast #environment  Coloplast Sustainability Report 2020/21, page 10.         ",551,4.0
Michelle Gordon," Exciting news today from those us of engaged in circular economy and product design   The European Commission just released a new package of #CircularEconomy proposals as part of the #EUGreenDeal.   These new rules aim to make almost all physical goods on the EU market more environmentally sustainable, circular, and energy efficient throughout their lifecycle, and include:    An update of the Eco-Design directive  A digital product passport   A strategy on sustainable and circular textiles  New rules on 'green claims' / communicating product sustainability  I’m exciting to digging into these documents in the coming days to understand just how ambitious they are.   Please don’t hesitate to hit me up for a cup of coffee if you’re interested in comparing notes! ️  Check out the press release: https://lnkd.in/exQPP594 Watch the press conference: https://lnkd.in/eUJgExnv ",552,1.0
Anguie Contreras,"Dear LinkedIn network,  On Sunday, April 3, 2022, the ""Circular Economy. Environmental Footprints and Eco-design of Products and Processes"" book was published by Springer, the global publisher of Springer Nature Group. The latter represents my beginning in scientific research field.  The book has thirteen high-impact chapters developed collaboratively by the ""Global Business Research"" International Business degree group at Universidad de Lima. I am extremely grateful for the opportunity and teachers in charge of the research group support.  Below, I share the following links to the two chapters in which I participated as co-author:  • Virtual Education: Carbon Footprint and Circularity    https://lnkd.in/dAiY8JrM  • Circular Economy for Food Loss Reduction and Water Footprint    https://lnkd.in/d-d_qKtp  Let's go for more!   #springer #scientificresearch #internationalbusiness #sustainability ",553,2.0
ready2LOOP,"Next stop on the intro tour is our student assistant Ebbe Bliksted. Ebbe is working alongside Jytte to help spread the word on circular economy and the ready2LOOP platform.    He is currently studying Design & Innovation on the 4th semester at DTU - Technical University of Denmark. Ebbe has a great interest in Eco-design and wants to create products and systems that limit the impact we have on the planet.    When he is not at DTU he spends his time playing football or reading a good book.   Welcome to the team, Ebbe!   #team #circulareconomy #danishindustry ",554,4.0
"Dr Subramanian Senthilkannan Muthu, PhD in Textiles Sustainability","Call for Potential Authors for Publication of Scientific Books by Springer- Nature- Book Series: Environmental Footprints and Eco-design of Products and Processes- Series Editor: Dr Subramanian Senthilkannan Muthu  Interested Authors can reach out to me directly by a PM.   This series aims to broadly cover all the aspects related to environmental assessment of products, development of environmental and ecological indicators and eco-design of various products and processes. Below are the areas fall under the aims and scope of this series, but not limited to: Environmental Life Cycle Assessment; Social Life Cycle Assessment; Organizational and Product Carbon Footprints; Ecological, Energy and Water Footprints; Life cycle costing; Environmental and sustainable indicators; Environmental impact assessment methods and tools; Eco-design (sustainable design) aspects and tools; Biodegradation studies; Recycling; Solid waste management; Environmental and social audits; Green Purchasing and tools; Product environmental footprints; Environmental management standards and regulations; Eco-labels; Green Claims and green washing; Assessment of sustainability aspects.  #sustainability #recycling #sustainable #management #design #water #wastemanagement #environmental #development #energy https://lnkd.in/gv-PqM8b ",555,1.0
Alex Fung,LED T5 tube handily replaces a T5 fluorescent tube with mercury free. Adopts an Eco-design lighting product to contribute sustainable development. #Prosperity #Prosperitylamps #KANDOlite #LEDTube #T5 #T5ECG #CIC #GreenProductCertification #sustainabledevelopment ,576,2.0
eolos | engineering the future,"The next 5 years will be critical to mitigate global warming, we know it, you know it (in any case, you should know it !)...    According to the World Economic Forum, the industry sector is responsible for one-fifth of the human activity related green-house gas (GHG) emissions, while consuming more than half (54%) of the world’s energy sources. As a result, more and more manufacturing companies acknowledge this responsibility and commit to their #decarbonisation .  On this ambitious journey, those companies have to transform and sometimes reinvent themselves. Coincidentally, they must pursue the first small steps and prepare for the forthcoming leaps, supported by innovation.   In order to accompany them at all levels, eolos | engineering the future and Naldeo Technologies & Industries combine their expertise. We cooperate with you to:     Build an operational decarbonisation strategy and engage a transformation project   Decarbonise production sites with #energyefficiency, #renewableenergy and process #innovation, from diagnosis to onsite hand-over   Imagine new circular economy and eco-design opportunities for products   Do not wait: the low-carbon economy is already there, it’s time to shift your company.  Would you like to know more about how to get started ? Let’s talk !  Henri Cuin, Jonas Briese, Alexis Scotto d'Apollonia, Anne Boggione         ",577,2.0
Turatsinze Jr,"I am very pleased to see that the ""flash team,"" for the Design Engineering Project of Sanitation Quality Water, which was developed and will be designed for developing countries through United Nations support in its SDG's Goals, is moving forward. United Nations World Eco-Design Conference (WEDC) Zhejiang University SDGs #design #university #engineering #project #design #quality #water #team  link to visit progress https://lnkd.in/eX-qxu4S  The team behind this amazing project         ",578,4.0
Aurore Mourette,"Passionné par l'#économiecirculaire? Je recherche un Chef de Projets ""Economie Circulaire"" pour reprendre la coordination des mesures ""Circular Design"" (eco-design) de la stratégie wallonne ""Circular Wallonia"" pour l'industrie des plastiques.   Vous aurez la chance de travailler en étroite collaboration avec les fédérations belges essenscia, Denuo, la fédération Wallonie Bruxelles représentant les ONG environnementales (Inter - Environnement - Wallonie), le Pôle de compétitivité GreenWin, l'équipe du cluster PLASTIWIN et directement avec la Cellule de coordination Circular Wallonia et le Cabinet du Ministre Willy Borsus.   Une belle opportunité pour accompagner des entreprises wallonnes de l’industrie des plastiques vers plus de circularité!   Postulez avant le 24 avril!   Plus d'info: https://lnkd.in/dpZrgqXr #job #emploi #environnement ",579,4.0
Eco-mobilier,"En direct du salon MAISON&OBJET,  Dominique Mignon, Antoine Roset, Fabien Cambon et Antoine Covillers présentent l’Innovation Day, notre rendez-vous annuel dédié à l’éco-conception.   Cet événement fait partie de notre programme « Innovation for Eco-design », qui consiste à mettre en relation nos adhérents et des innovateurs aux solutions durables et viables afin d’éco-concevoir ensemble des éléments d’ameublement   Retrouvez nos équipes à l’entrée du hall 6 pour échanger et poser toutes vos questions          ",580,4.0
The MUZES,"[Krups] Development of a landing page to support the launch of the latest eco-designed automatic expresso machine   Krups launches a new automatic expresso machine that ensures perfect coffee taste, all with an eco-design approach. As coffee addicts, The MUZES who have been working with the brand for several years was delighted to support the brand on the digital launch of this innovation. With the objective to present and explain the new machine, the landing page is an essential touchpoint for customers in the purchase process. The aim? Gather and organize all of the contents to convey the right messages to future customers at the heart of the brand site. The speech structure was established through a simple but very effective methodology.  Thank you to Sophie GANNAT and Julie BURY for your trust. And thanks to all the talents who collaborated on this project.   Check out the link in the comments for more info.   #digital #landingpage #contentmarketing #digitalmarketing #development #wearethemuzes ",582,4.0
Josep Capdevila Garolera,ALVIC emerge en Maderalia con su concepto Eco-design.  http://ow.ly/4ZhJ50IrYSN ,583,4.0
