authors,content,doc_id,note
Dr Agata Slater,"Something nice happened over the weekend. I received a bottle of wine from friends who were visiting me. While that’s pretty nice in itself, what cheered me up even more was that the bottle was #blockchain #certified.   My friends do not know much about what I exactly do for a living so the choice they made in the store was not about pleasing me. When I asked about what made them buy this particular type of wine, they mentioned that (apart from the general wine preferences), they liked that there was some sort of quality #certificate on it, and that they could interact with the product via the #qrcode (without knowing at all what “blockchain” meant).   After scanning the QR code, the consumer sees but a full account of the wine’s DNA: when and where the grapes were harvested, how the wine was treated – for example the quality of the sulphites – the bottling date, lot number and more. This information is based on #data captured during each stage of the wine making process, and recorded into a blockchain.   This is a wonderful, real-life example of a consumer choice being influenced by product #quality. This is very much in line with CarrefourSA observations that #blockchain tracking can boost #sales of some products:   https://lnkd.in/dYuVMcXM   For me, it also also very rewarding to see the impact of blockchain technology right in front of me. This is a real story btw!   And kudos to #CasaGirelli wine makers for caring about their consumers and helping them make informed decisions about purchases.  #blockchain #provenance #trackingsolutions #traceability #sustainabilty #consumercentric ",769,3.0
Mazda Motor Europe,The Mazda Motor Corporation has held a ceremony marking the start of mass-production of the all-new Mazda CX-60 crossover SUV at Hofu Plant No. 2 in the Yamaguchi Prefecture on 18th April 2022. Mazda’s new flagship introduces the company’s first plug-in full hybrid technology to the European SUV market and represents everything that has built into its DNA over the last 100 years. #Mazda #CX-60         ,770,4.0
The Times of Israel,"The cultivated meat consortium includes 14 companies, including Aleph Farms, SuperMeat, Tnuva and Seevix Material Sciences (makers of synthetic spider silk), and 10 academic and research institutions like Tel Aviv University, the Technion - Israel Institute of Technology, and Reichman University (IDC Herzliya).  The Good Food Institute Israel, Gaya Savyon, Alla Voldman Israel Innovation Authority רשות החדשנות Shay Cohen #foodtech #culturedmeat #Israel #tech #cultivatedmeat #foodsecurity #innovation #food ",771,4.0
Prangya Nibedita,"Happy to share that I have completed ""C++"" Stream Training and assessment in the Tech Expressway program at Accenture.  Thank you, Accenture in India for giving all the support and learning environment.  Accenture Technology  #C++ #accentureindia #learning #training #tech #technology #environment #india #thankyou ",772,4.0
Nombuso Magagula,A Btech: Information Technology (Communication Networks) graduate         ,773,4.0
Ahmad Daleen,"Thanks for providing a good education platform, so that we managed to launch Deemples successfully  Limkokwing University of Creative Technology #technology #university #startuplife #golf ",774,4.0
Vitor Hugo - Coordenação e Gestão de Projectos S.A.,"PROJECT VHM // Escola Superior de Tecnologia e Gestão  O projeto consiste num novo edifício de investigação da ESTG, que faz por sua vez a articulação entre outros equipamentos existentes na propriedade. Do ponto de vista da conceção arquitetónica, o desenvolvimento do projeto centra-se em várias premissas principais, que muito envolvem a integração do edifício no tecido urbano, a sua articulação com a topografia e a vivência do utilizador. A volumetria é a imagem de marca do edifício. Este apresenta-se como um monolítico esculpido, inspirado na “máquina”, assumindo-se por uma forma irreverente, espontânea e veloz, conferida pelos seus ângulos retos e formas distorcidas, pretendendo assumir-se como um objeto de destaque da cidade, um marco dinamizador. Neste sentido, o edifício insere-se no centro do seu terreno, liberto das construções envolventes, de forma a ser também observado, de mostrar a sua forma e volumetria, desenvolvendo-se voltado para a paisagem ao redor, com a inserção de vários pontos de interesse e de permanência.  Technology and Management School  The project consists of a new research building for the ESTG, which in turn provides the connection between other existing facilities on the property. The architectural conception approach is centred on several main premises, which greatly involve the integration of the building into the urban context, its articulation with the topography and the user’s experience. Volumetry is the building’s brand image. It stands as a sculpted monolith, inspired by the “machine”, adopting an irreverent, spontaneous and swift shape, conferred by its right angles and distorted outlines, with the purpose to be a prominent object of the city, a dynamic landmark. As such, the building is located in the centre of its site, free from the surrounding constructions, so that it can also be observed, show its shape and volumetry, and evolve towards the surrounding landscape, with the insertion of several points of interest and permanence. #vhm #project #building #technology ",775,4.0
CoinMarketCap,Crypto billionaire Sam Bankman-Fried says he would be 'excited' to help Elon Musk transform Twitter — and blockchain technology could play a big role  https://lnkd.in/dTeeHc5V ,776,4.0
Thierry Mortier,"Is #wireless #EV charging ️ the future for dense urban areas? Such a great experience to see this at work in #Oslo on DAY1 of or #EY #Norway  exploration tour.  Early days of course: rather expensive and technology implemented through retrofits at this stage. Very promising at the same time, with no kerbside infrastructure and potentially smaller car batteries  and cheaper EVs .  #MomentumDynamics ",777,3.0
Declan Burke,"Like many technology professionals, my career has moved into the world of cyber risk and information security.  For me, this presents an opportunity to make a real difference, knowing that the threat from cyber criminals is more significant than ever.  The CISM covers the key pillars required to mature an organisations security posture.  I'm grateful to Laura Linturn and The Standard P&I Club for investing in my continued professional development.         ",778,4.0
Jayesh Gohel,"Successfully Completed data science for engineer. #datascience #technology #engineer   Thanks Indian Institute of Technology, Madras ",779,4.0
Lindsay Hall,"I have recently left KPMG after 5 years in Technology Consulting. I decided it was time for a change. I'm currently taking a break whilst completing a leadership coaching diploma. I'm really excited about the challenge ahead and spending some time thinking about what the next stage of my career looks like. I really enjoyed my time at KPMG, where I learnt a lot and worked on some interesting (and some tough) projects. Most importantly, I met some great people, who've provided me with support and friendship for which I'm very grateful.         ",780,4.0
BG Consulting Engineers,"Existe-t-il un modèle Suisse de Smart City ? Ces dernières années, l'engagement de la Suisse en matière d'#écologie a été récompensé en s'illustrant dans de nombreux classements internationaux. L'#innovation dans les #smartcity Suisse a-t-elle contribué à ce classement ?         ",781,4.0
Pascal Parent,"U2P de l'Ariège, CAPEB CNATP Ariège, ATIS.cloud, Leica Geosystems part of Hexagon, AutoDesk, Académie de Toulouse, Campus des Métiers et des Qualifications d'Excellence BTP et usages du numérique, Emmanuel Di Giacomo, Nicolas Volic, Vincent Perez, #energie3dconstruction, #bim, Envirobat Occitanie, ADN CONSTRUCTION - PLAN BIM 2022 ",782,4.0
Martin BOUVRON 🐺,"[#Metaverse]  Après un peu moins d'un an de disponibilité en accès anticipé, l'Unreal Engine 5, nouvelle itération du moteur de développement 3D temps réel d'Epic Games, est désormais officiellement disponible pour tous.   Petite piqure de rappel pour les startups qui ont tout intérêt à s'intéresser à cette technologie qui monte. Au risque de manquer de belles opportunités, mais surtout de passer complétement à côté de la révolution qui s'annonce.         ",783,4.0
Antoine GREGO,"Comment combattre efficacement le paludisme ?  Cette semaine dans la newsletter :  𝐋𝐞 𝐩𝐨𝐝𝐜𝐚𝐬𝐭 Demain & Durable     Dans l’épisode du jour, je souhaitais vous repartager le parcours et les ambitions de Franck Langevin. Après avoir travaillé dans le monde de la tech, Franck a décidé d’évoluer drastiquement et de s’envoler au Burkina Faso pour rejoindre Gerard et fondé MAÏA Africa.  Leur objectif : réduire la mortalité due au paludisme grâce à leur pommade. Un échange qui m’a fortement marqué il y a plus d'un an, et qui j’espère vous inspirera également.  Mais également :   𝐋’𝐚𝐜𝐭𝐢𝐨𝐧 𝐝𝐞 𝐥𝐚 𝐬𝐞𝐦𝐚𝐢𝐧𝐞 : Prendre soin de sa TV  Une TV émet en moyenne 200 kg de CO2 lors de la fabrication, et 156 lors de son utilisation ! Il est nécéssaire de comprendre l'impact de la TV et comment limiter son impact avec quelques conseils et notamment le partage d'une étude HOP // Halte à l'Obsolescence Programmée sur le sujet que je vous recommande !   𝐋𝐞 𝐜𝐡𝐢𝐟𝐟𝐫𝐞 :1er Janvier 2023  La bonne nouvelle de la semaine, c’est le décret sorti le 14 Avril dernier sur le greenwashing qui oblige les entreprises à publier leurs démarches d'atteinte à la neutralité carbone. Malheureusement pas suffisant car le champ d'application reste trop grand. Pour aller plus loin je vous recommande de taguer Alerte Greenwashing ou Pour un réveil écologique si vous voyez une pub faisant preuve de #greenwashing   𝐋𝐞 𝐜𝐨𝐧𝐭𝐞𝐧𝐮 : Les métaux rares    Depuis que je dois rechercher chaque semaine un contenu à vous partager, je me rends compte qu’Arte est l’une des seules chaînes avec autant de contenus sur l’environnement (je suis donc devenu fan d'ARTE). Dans un format 5 minutes, les formats “Data Science” permettent de mieux comprendre différents sujets. Aujourd’hui, je vous propose de parler donc des métaux rares !   A mardi prochain !  #newsletter  #impactpositif #ecologie #paludisme ",784,3.0
Unitel Group,La protection des données dans le cloud devient de plus en plus importante.  Voici les solutions à repenser en amont.   #cloudsecurity #data #cybersecurite ,785,4.0
Netinvestissement, Quels sont les 10 meilleurs placements de 2022 ?  Réponses dans cet article          ,786,4.0
Imed BEN RHOUMA,"Une entreprise ne peut plus innover seule. Elle court le risque de prendre davantage de retard. S’appuyer sur des partenaires porteurs d’innovations permet d’aller plus vite dans la création de valeur que de le faire seul. Et lorsque cette valeur est créée, produite et délivrée beaucoup plus librement on est dans de l’Open Innovation en Marque Blanche #openinnovationmarqueblanche. Elle permet, au demandeur, d’accélérer le go to market de son usage innovant, tout en garantissant au porteur la totale maitrise de son innovation.         ",787,4.0
Pascal Marrant,"L’amour est doux comme une onde divine, un mot parmi tant d’autres, et parfois, il apparait surgissant de nulle part et votre être tout entier est foudroyé en un instant. L’amour submerge pour papillonner en pampilles soyeuses, un feu d’artifice où j’ai simplement ajouté un des bijoux Baümer pour le faire glisser vers l’authenticité, la sincérité, et la fidélité. Je vous parle de celle de mes rêves les plus enfouis, de cette femme au bord du paradis de mon cœur qui m’ensorcelle le jour et qui la nuit comme la déesse minerve illumine mes nuits des feux de l’enfer. Doux bijoux que tu portes sur toi, qui avec tes yeux bleus, comme le ciel, réchauffent ma vie de caresses enrobées de douceur. En recevant ce présent, je marche sur la voie lactée qui baigne dans ton âme et brille à jamais à travers les cieux. Je me demande, chaque jour, chaque nuit, comment font ceux qui n’ont jamais eu prés d’eux, ni ton sourire ni ton regard. Si la haine est la nécropole de l’âme, l‘amour est l’expression du cœur, et pour une juste compensation, une boucle d’oreille du battement de mon cœur Baümer vient sceller celui-ci à jamais. F https://lnkd.in/dKkjChku ",788,4.0
Anne idride de Saudium,"A MICHEL QUI AIMAIT TANT MES TEXTES  Tu étais le plus reconnaissable de nos acteurs Français, et c’est moi qui vais te rendre aimable, toi l’homme de « La femme infidèle » si froid et si machiavélique. Tu planais en apesanteur les yeux brillants, pleins de candeur, et de subtilité, bouche en croissant au beurre pour jouer « Le Colonel Chabert ». Ce soir, je broie du noir car je viens de perdre ton au revoir, et j’ai les mains moites, les mêmes, que ce chef d’entreprise haïssait, si bien modelé dans « Le Jouet ». Voici mes cortèges de larmes qui tombent, et je suis pétrifié par cette nouvelle. La gorge serrée et le cœur battant, je voudrais une dernière fois voir ton sourire, même si celui-ci doit me coûter ma fortune, car il enrichira ceux qui le recevront, sans appauvrir celui qui le donne. Ton souvenir restera éternel, et personne n’est assez riche pour s’en passer ni assez pauvre pour ne pas le mériter. Tu créais le bonheur dans les foyers et tu étais le signe sensible de l’amitié de « Tous les matins du monde ». Nul n’a autant besoin d’un sourire même sarcastique que celui qui perd un ami. Alors, salut l’artiste, adieu à ce tigre recréé par la magie de ton interprétation où Michel tu te glissais avec génie dans la peau de « Clémenceau » pour au final nous donner un bouquet d’émotion. Voici le sentiment de la vie réelle qui t’abandonne aujourd’hui peu à peu, sous les ondes insondables de cette mer où les rêveurs des théâtres, ont laissé leur raison, sous les applaudissements. F  https://lnkd.in/ewYGKfMY ",789,4.0
InterLab SAE,« Nous ne pouvons ressourdre nos problèmes avec les habitudes de pensée qui les ont créés ». Cette citation d’Albert Einstein peut bien expliquer la démarche de l’OCP de créer une plate-forme d’open innovation #innovation #OCP #OpenInnovation ,790,4.0
Digital Pen Corporation,"Aujourd’hui, toutes les activités sont touchées par la #transformationdigitale . En effet, la #digitalisation  offre l’opportunité non seulement de gagner en efficacité, mais aussi de pouvoir mieux répondre aux attentes de ses #collaborateurs  et de ses #clients .   Découvrez dans cet article les clés d’une digitalisation réussie et par où commencer.          ",791,4.0
Ma Consultante Bien-Aimée," L’interview du mois de @MaConsultanteBienAimée !   La magie de cette rencontre : prendre conscience que l'ADN transforme la culture de l'entreprise.  Ce mois-ci, nous rencontrons Céline Aupin Coulbault, révélatrice des richesses humaines à la MAIF. Nous avons exploré avec elle les liens entre identité, image de marque et fonctionnement d’organisation… pour révéler l’impact de l’ADN dans son entreprise. #ADNimpact #marqueADN #ADNconnect   Retrouvez notre abracadabra à l’issue de l’interview, pour profiter de conseils et éclairer vos propres transformations !   Merci à Céline Aupin Coulbault de la MAIF  Magicalement vôtre  Florence & Cécile Ma Consultante Bien-Aimée #MarketingDeValeur #Engagement #Management #Communication #RessourcesHumaines #conduiteduchangement ",792,4.0
Antoine Vial,quelques réflexions entre les deux tours que je partage avec vous. #santé #élection #trésormenacé #macron #lepen ,793,4.0
Service Informatique,"Le système d’information est au cœur de chaque entreprise, quelle que soit sa taille ou son domaine d’activité. Nous vous aidons à en connaître le fonctionnement et le rôle qu'il joue pour votre entreprise !         ",794,4.0
Naully Nicolas,"La #souveraineténumérique désigne la capacité de contrôler sa propre destinée numérique, c'est-à-dire les données, le matériel et les logiciels dont on dépend et qu'on crée. Elle est devenue une préoccupation pour de nombreux décideurs politiques qui estiment que trop de contrôle est cédé à trop peu d'endroits, que le choix est trop limité sur le marché des technologies et que trop de pouvoir est entre les mains d'un petit nombre de grandes entreprises technologiques.  L'une des principales préoccupations concernant la souveraineté numérique est qu'un petit nombre de grandes entreprises technologiques contrôlent des quantités massives de données sur leurs utilisateurs. Et avec autant d'utilisateurs et autant d'informations, leurs politiques et leurs actions peuvent avoir une influence considérable. Twitter, qui a banni plusieurs utilisateurs très connus de sa plateforme, en est un exemple. Cela a conduit certaines personnes à reprocher à l'entreprise de restreindre la liberté d'expression.  #digitalregulation #transformationnumerique #digitalsovereignty #innovation #transfonum #technologie #transformation #gafam #leprince #machiavel #digital #intelligence #entreprises #digitalgovernance   Poke Gabriel Stéphane Koch Pierre-Alexandre Kleiber Décideurs Magazine - Groupe Leaders League  Chrysostome Nkoumbi-Samba, MBA Luigi Matrone Giuliano Liguori Pierre Berendes Jean-Henry Morin Jean de Dieu GBENOUTIN BADE Stéphanie Bretonnière  Jonathan Chan Isabelle Piel Vincent Champain Edith JolicoeurEmmanuel Chiva Cédric DENIS-REMIS Hervé Grandjean Éditions des Équateurs Gilles Ruffieux Portail de l'Intelligence Économique Aline Isoz Chrysostome Nkoumbi-Samba, MBA Stéphane Séguin Giuliano Liguori Ecole de Guerre Economique – EGE  Aimé Mukuma Reine Toungui Dominique Bruno Haden Nathalie KIENGA Kriss Brochec  Digital entrepreneur Dr. Kany Toure noelle van der waag-cowling Abdul Hakeem G.Modeste MIOKO D. Pascaline ODOUBOUROU Eve Gani Denise EPOTE ",795,4.0
Philippe Métais,"Bénéficiant d’un de nos accompagnement, la start-up ENTENT est l’un des 5 lauréats de l’appel à projet de GRDF sur la Décarbonation de l’industrie lancé au cours du premier semestre 2021. Elle développe une solution innovante de production d’électricité à basse température, baptisée “Pulse”, au moyen d’un moteur nouvelle génération.    Découvrez le projet en détail dans cet article !   #GRDF #Energie #TransitionEnergétique ",796,4.0
Anthony BURATTO," L’audit informatique est un incontournable pour toute entreprise !  Les changements et les évolutions de votre structure informatique ne sont pas toujours sans conséquences…   Pour un système d’information vous apportant croissance et compétitivité  c’est un audit informatique qu’il vous faut !     Vous bénéficiez ainsi d’une évaluation précise de l’ensemble de la structure informatique et de 𝗰𝗼𝗻𝘀𝗲𝗶𝗹𝘀 d’optimisation.    Concrètement, les principaux avantages sont :   Une optimisation du fonctionnement et de la sécurité de vos systèmes  Une amélioration de la productivité et l'expérience collaborateurs  Une meilleure maîtrise des coûts et des budgets    Rendez-vous dans l’article ci-dessous  pour découvrir encore plus d’informations sur l’audit informatique et ses avantages.  Je vous ai également listé les différentes étapes à suivre pour un audit réussi     #audit #informatique #entreprise #cybersécurité #infogérance #IT  BA Info ",797,4.0
CTM Solutions / CTM Group,#Avid #LucidLink #Wasabi #IBM #Aspera #CTMSolutions #CTMGroup #Postproductions #RemotePostproduction #RemotePost #Cloud #Transfertdefichier #Delivery #Montage #Mediacomposer #Filesystem #MediacentralFlex #NexisEdge #AsperaEnterprise #AsperaOnCloud Avid Jacques Di Giovanni FICAM Pro Fabien MARGUILLARD Laurent Martin Richard C. Sandie JAIDANE Jonathan Légal CTM Solutions / CTM Group PIERRE LEBERRIGAUD Julien Coeffic ABDEL NASSIH Maximilien Levisse Laurent Godmé David Cayla Rupert Watson Ana Escauriaza Leal ,798,4.0
Jean-François Sebastian,"Cette année sera le thème de l'#environnement  ! ... plus globalement des critères #esg. Je partagerai avec vous au travers de plusieurs Newsletters ma réflexion sur le positionnement de la Tech sur ces enjeux : leur rôle, leurs devoirs, leurs capacités. N'hésitez pas à réagir, enrichir et commenter déjà sur cette #1 ! SAS; Xavier PERRET, Fabien CROS, Fabrice Bonnifet, Fabien Rech, Eglé de Richemont         ",799,2.0
elodge,"Eloge de l'expertise #4   Retrouvez l'interview de Julien Carla, DRH externalisé chez Bras Droit des Dirigeants Ressources Humaines.  #ressourceshumaines #rh #expert #interview ",800,4.0
Benjamin Beaudet,"Avec un we de 3 jours, la vigie de beti a eu le temps de creuser deux sujets s'agissant d'un des protocoles safety de Cruise et du mouvement sur la chaîne de valeur des systèmes de transport automatisé comme Bosch. #transport #safety #MobilitéAutonome #navetteautonome ",801,4.0
Edouard Bonnefous,#innovation #mechanicalengineering #energyefficiency #ICEngine #hybrid #phev #aerodynamics #co2 #climateaction #FitFor55 #futureofmobility #futureofeurope ,802,4.0
Francois Mouclier,Doing Business in France est une initiative de la Chambre de commerce franco-britannique organisée conjointement avec l'Ambassade de Grande-Bretagne et Your Experts in France afin d'aider les entreprises françaises et britanniques à mieux comprendre l'économie de la Normandie et à s'y installer. #normandie https://lnkd.in/eE3sZAgS ,803,4.0
"Maxime Lacasse, ECBA, POPM","La lettre a probablement un objectif valeureux. Aviser les clients de changements à la politique de confidentialité des renseignements personnels... Mais est-ce vraiment nécessaire? Les changements sont peut-être en faveur du client, peut-être pas... on ne le sait pas.  ---- Tu aimes cette publication ? Clique J'aime, Suivre et Partager!  Je m'appelle Maxime Lacasse, je suis...  -Product Manager -Analyste d'affaires -...sur des projets de transformation numérique au quotidien. -mordu de nouvelles technologies et de nouvelles méthodes de travail. -passionné par la diversité culturelle et par les impacts humains des changements technologiques ! -Joins-toi à moi pour relever ensemble le défi d'aller vers l'autre!  Привіт! Мені цікава ваша думка, діліться нею в коментарях!  #innovation #leadership #transformation #management #businessanalysis #productowner #cybersecurity #digitaltransformation #бизнесаналитик #machinelearning #iiba #productmanagement #cinqpourquoi ",804,4.0
Philippe Dornbusch, Une équipe de scientifiques s'interroge sur le type de message à envoyer dans l'espace pour pouvoir communiquer avec une autre forme de vie. L'une de leurs idées serait d'établir le contact avec une partie d'échecs dans le but de familiariser les extraterrestres avec notre forme d'intelligence.  #Echecs #Chess #Ajedrez #Шахматы #concentration #logique #memoire #jeu #reflexion #ecole #education #stratégie #tactique #coaching #sport #santé #sciences ,805,4.0
Fernando A.G. Alcoforado,"A CONTRIBUIÇÃO DA ENGENHARIA AO PROGRESSO CIENTÍFICO E TECNOLÓGICO    Fernando Alcoforado*    Este vídeo tem por objetivo demonstrar que a Engenharia moderna se caracteriza pela aplicação generalizada dos conhecimentos científicos à solução de problemas dedicando-se, basicamente, a problemas da mesma espécie que a engenharia do passado, porém, com a característica distinta e marcante que é a aplicação da ciência. É sabido que a Engenharia está presente em todo o setor produtivo, a saber: nas fábricas, nos canteiros de obras habitacionais e de infraestrutura, nas universidades, nos laboratórios científicos, nos centros de pesquisas tecnológicas, nos transportes, na geração de energia, nas comunicações, na produção de alimentos, entre outros empreendimentos. As grandes mudanças que vêm ocorrendo na vida das pessoas, no mundo moderno, foram geradas pela tecnologia que é alimentada pelo conhecimento acumulado e os grandes investimentos em pesquisa e inovação. A humanidade precisa da Engenharia porque é ela que transforma o conhecimento acumulado em universidades e centros de pesquisa, públicas e privadas, em produtos e serviços disponibilizados à sociedade. A transformação do conhecimento produzido em laboratórios por profissionais de várias áreas, inclusive engenheiros, cabe aos engenheiros projetar e realizar. Não é à toa que em todas as definições da engenharia, e são muitas, encontramos as palavras “aplicação prática de princípios científicos visando à transformação da natureza com economia de recursos”.    * Fernando Alcoforado, 82, condecorado com a Medalha do Mérito da Engenharia do Sistema CONFEA/ CREA, membro da Academia Baiana de Educação, engenheiro e doutor em Planejamento Territorial e Desenvolvimento Regional pela Universidade de Barcelona, professor universitário e consultor nas áreas de planejamento estratégico, planejamento empresarial, planejamento regional e planejamento de sistemas energéticos, é autor de 15 livros abordando temas como globalização, desenvolvimento econômico e social no Brasil e no mundo, aquecimento global e mudança climática, energia no mundo e no Brasil, as grandes revoluções científicas, econômicas e sociais, ciência e tecnologia e cosmologia.         ",806,4.0
