authors,content,doc_id,note
Jean-Marc Jancovici,"Après l'analyse des programmes présidentiels par Les Shifters, c'est au tour de The Shift Project de vous proposer un exercice voisin mais convergeant : nous avons demandé à tou(te)s les candidat(e)s aux présidentielles de nous envoyer une lettre pour décrire comment ils comptent concrètement gérer la sortie des énergies fossiles au cours du prochain quinquennat.  Tou(te)s les candidat(e)s nous ont répondu sauf Emmanuel Macron et Jean Lassalle  Ces lettres ont été analysées - sur la base de leur seul contenu, et donc sans se référer ni au programme ni à des déclarations faites dans d'autres enceintes - par une équipe du Shift Project, et les résultats sont mis en ligne depuis ce matin sur le site internet de l'association. Nous avons publié un commentaire général sur les contributions ainsi qu'un avis détaillé par lettre.  Les deux analyses convergent largement mais réservent quand même quelques surprises. En particulier, certaines lettres sont plus détaillées que les programmes, alors que d'autres ne mettent pas en avant les propositions contenues dans les programmes.  Mais l'avis général qui se dégage est que nous restons encore assez loin : - d'une bonne compréhension du problème à traiter : globalement nous allons devoir gérer plus de conséquences adverses avec moins de moyens matériels, or nombre de candidats proposent en pratique des solutions du monde infini pour régler des problèmes du monde fini,  - d'une intégration d'un monde très changeant dans les plans pour l'avenir ; en particulier ""l'adaptation"" est très peu présente dans les réponses - d'une stratégie de réponse quantifiée et échéancée intégrant des aléas qui ne manqueront pas de survenir.  Il ne reste qu'une grosse semaine jusqu'au premier tour. La probabilité que les copies s'améliorent significativement d'ici là est donc très faible. Une des questions posées est alors de savoir qui, parmi les candidat(e)s, sera à même de se poser les bonnes questions une fois élu(e), si ces questions n'ont pas été posées avant.         ",421,4.0
Jean-Marc Jancovici,"La Belgique vient de repousser de 10 ans la fermeture de 2 réacteurs nucléaires, fermeture qui était prévue pour 2025, en conséquence directe de la ""crise du gaz russe"".  Il faut évidemment se réjouir de cette décision, qui conduira à des économies directes d'émissions de CO2 alors même que le monde vient de connaître en 2021 un effacement total du ""creux"" de 2020 en ce qui concerne les émissions de CO2 (voir article de Sylvestre Huet à ce sujet : https://lnkd.in/ddwqQFsG ).  Dans le même esprit, on note que, dans le programme présidentiel des Verts français, il n'est désormais plus question de fermeture anticipée des réacteurs en service (alors qu'initialement il était question d'une sortie complète du nucléaire le plus vite possible).  Pourquoi certains politiques deviennent-ils moins hostiles à l'atome désormais ? Pour une raison assez simple : parce que l'avis de la population évolue. Ce n'est pas ""les faits"" qui les conduisent à changer d'avis (sinon ce serait fait depuis longtemps !) : c'est l'opinion.  Et c'est probablement pour cette même raison que l'Allemagne, elle, reste sur sa position historique en ce qui concerne cette source d'électricité. La population y évolue probablement moins vite en faveur de cette modalité de production qu'ailleurs.  Comme le soulignait un post récent de Maxence Cordiez, cela place les Verts allemands, à la fois contre le nucléaire civil mais aussi pour la paix, dans une situation désormais schizophrénique : le refus du nucléaire pour le choix du gaz (la puissance électrique installée au gaz a augmenté de 50% en 20 ans : https://lnkd.in/dshZdp7X ) conduit aujourd'hui à plus financer l'effort de guerre de Poutine que si le choix inverse avait été fait.  A plus long terme, cette position conduira à une autre schizophrénie : on se rendra compte que le refus du nucléaire a contribué à conserver plus de combustibles fossiles dans la production électrique, ce qui crée plus de changement climatique et détruit plus de biodiversité.  Mais ce changement, quand il survient, ne permet pour autant pas de se débarrasser de l'existant fossile à bref délai : redevenir favorable à la construction de centrales nucléaires ne fait sentir ses effets que 15 à 30 ans plus tard... à condition d'être ensuite déterminé et constant sur cette durée.         ",422,2.0
Jean-Marc Jancovici,"En cumul, les précipitations d'automne et d'hiver ont été proches de la normale sur une large partie du pays. Voici donc qui devrait nous rassurer. Sauf que... ces précipitations n'ont pas nécessairement été ""efficaces"" : quand ce sont des pluies torrentielles, elles contribuent de manière importante aux cumuls mais ne contribuent pas plus à la recharge du sol que des pluies qui auraient été plus modestes.  De ce fait, ces précipitations ""efficaces"" sont elles en déficit sur l'essentiel du pays par rapport à une saison automne-hiver normale (carte ci-dessous). Ceci allant avec cela, d'une part les nappes sont basses dans une large partie du pays (https://lnkd.in/eEyMdtMx ), et d'autre part les sols sont partout en France plus secs que la normale (https://lnkd.in/e5tNK-sR ).  Du coup on commence à se faire quelques cheveux blancs pour l'agriculture : https://lnkd.in/exiYGSzS , alors même que les événements en Ukraine sont déjà à la manoeuvre pour pousser les prix vers le haut et les quantités vers le bas.  Mais ce n'est pas grave : manger c'est juste 2% du PIB et les écosystèmes c'est gratuit !         ",423,3.0
Jean-Marc Jancovici,"La Russie est en train de faire des choses que l'Europe réprouve. Nous réalisons alors que d'être aussi dépendants de ce pays pour notre consommation de pétrole (un tiers des importations européennes viennent de Russie, et 75% du pétrole européen est importé - 96% pour l'Union) et de gaz (un tiers du gaz utilisé en Europe est russe) ne nous facilite pas la vie pour tenir tête à Poutine.  Qu'à cela ne tienne : nous allons nous passer du gaz russe. Est-ce possible ? Oui... à condition de nous passer d'une partie du gaz tout court. La société Rystad Energy (fournissant des bases de données sur le pétrole et le gaz) a livré l'analyse reprise dans le graphique en commentaire, qui montre que ""ca passe"" pour la moitié du gaz que nous livre la Russie, mais qu'il va falloir se passer de l'équivalent de la consommation française. Et, en pareil cas, personne ne sait à quel prix le gaz disponible le sera. Il est peu probable que les autres fournisseurs nous fassent des cadeaux.  Par ailleurs ce ""plan"" suppose d'augmenter l'électricité au charbon. Autant pour le CO2... et pourtant cela ne va pas totalement résoudre nos problèmes en ce qui concerne la dépendance à la Russie.  En effet, la moitié du charbon utilisé en Europe est importé, et la moitié de nos importations viennent... de Russie ! Le graphique ci-dessous, effectué avec des données BP Statistical Review, montre en effet qu'en 2020 c'était, et de loin, la Russie qui était le premier fournisseur d'Europe pour ce combustible solide. L'Allemagne n'y fait pas exception : elle dispose d'importantes réserves de lignite, ce ""mauvais charbon"" qui s'exploite dans des mines à ciel ouvert avec des excavatrices géantes, mais ne dispose plus de houille, qui est importée... pour une large part de Russie.  Qu'à cela ne tienne, dit le nouveau ministre (Vert) de l'économie, on va changer d'avis sur le nucléaire. Même si ce ""revirement"" est bienvenu, changer d'avis sur le nucléaire est, à court terme, aussi efficace que de décider de se tricoter un parachute si on a sauté de l'avion sans en avoir un, en emportant juste une pelote de laine.  Si la vie doit être difficile pour quelques années (voire plus) pour les pays qui ont décidé de s'appuyer sur la génération électrique au gaz, voire au charbon, il va falloir boire le calice jusqu'à la lie. C'est tout le charme des systèmes énergétiques : ils ne se reconfigurent pas toujours en une année, au fil des aléas qui surviennent. Il en sera de même pour le climat, sujet qui n'a pas été évoqué - même une seconde - dans le discours d'Emmanuel Macron prononcé Mercredi soir, alors même que le dernier rapport du GIEC, annonçant pire que la guerre en Ukraine, venait de sortir.         ",424,3.0
Jean-Marc Jancovici,"Dans une interview aux Echos, la directrice générale d'Engie explique que, dès l'hiver prochain, sans gaz russe il faudrait : - rationner le gaz - réglementer les prix (donc transitoirement ""supprimer le marché"").  On ne saurait mieux le dire : la ""libéralisation"" appliquée à l'énergie en Europe n'a pas fonctionné pour s'organiser en fonction du gros temps à venir, qui était absolument certain.   La guerre en Ukraine n'était pas prévisible dira-t-on. La guerre, certes non. Mais ""un événement"" qui allait rendre l'approvisionnement en gaz et/ou en pétrole compliqué, ça oui. Dès lors que les gisements de pétrole et de gaz sont épuisables, vient nécessairement un moment où... il y en a moins. La baisse subie des combustibles fossiles était déjà un fait en Europe avant cette guerre, alors que nous n'avons toujours pas pris le taureau par les cornes.  En 1973, ce n'est pas la guerre du Kippour qui a fait chuter la production de pétrole (voir cette analyse de Michel Lepetit parue dans Le Monde : https://lnkd.in/eZa7SfKu ), ou plus exactement qui a fait passer le monde d'une production de pétrole augmentant de 8% par an à une production augmentant d'un petit % par an. C'est la physique : la production ne pouvait juste pas continuer à augmenter au même rythme.  De même, la guerre en Ukraine ne fait qu'amplifier une fragilité sous-jacente de l'Europe : celle de l'absence de plan cohérent pour réellement sortir des combustibles fossiles.   La directrice générale d'Engie affirme que ""Mon espoir est que, dans ce nouveau monde, la société regardera les énergies renouvelables différemment. Elles représentent une source, certes intermittente, mais quasi infinie, implantée chez nous, compétitive, et qui nous permet de ne dépendre de personne"".  Bien sur que nous allons devoir développer certaines ENR. Pour autant : - éolien et solaire sont ""infinis"" mais les métaux pour la collecter, non (et il en faut beaucoup plus qu'avec les fossiles) - ""dépendre de personne"" est inexact : l'Europe n'a pas de mine significative sur son sol, - ""une source certes intermittente"" signifie que, sans stockage massif (pas du tout évident qu'on y arrive), l'électricité n'est plus disponible à la demande (ce matin, sans fossiles, il y en aurait peu : https://lnkd.in/eKmfFCM6 ) - ""compétitive"" si on se limite au cout de production, mais... RTE a rappelé récemment que ce n'est pas légitime et qu'il faut regarder le cout de l'ensemble du système.  Engie pousse aussi le ""gaz vert"". C'est une bonne idée... mais pour en faire du carburant pour la mécanisation agricole (et progressivement supprimer le gaz dans le chauffage).  Engie écarte enfin la prolongation des centrales nucléaires belges. A court terme, avec la baisse de la demande partout où c'est possible (transports, chauffage) c'est pourtant la chose la plus utile à faire.         ",425,3.0
Jean-Marc Jancovici,"Un plein à la pompe neutre en carbone ? Un vol en avion neutre en carbone ? Une centrale électrique au charbon neutre en carbone ? Tout cela est désormais possible en France, avec la bénédiction du législateur.  Quelques jours à peine après la sortie du dernier rapport du GIEC, et alors que l'actualité nous rappelle avec force que la dépendance aux énergies fossiles est porteuse de risques indépendamment du climat, le gouvernement français vient de préciser, dans un décret, les modalités d'application, en matière d'allégations de neutralité, de l'article de la loi climat et résilience de juillet dernier.  Dans la version initiale du projet de loi, il était juste interdit de parler de ""neutralité"" d'un produit ou d'une entreprise, ce qui était la conséquence logique d'une observation des faits : alléguer qu'un produit ou service a été élaboré sans émissions, ou en utilisant un ""balai spécial"" qui aurait fait disparaître ces émissions comme si elles n'avaient pas eu lieu, est en fait une affirmation invalide (https://lnkd.in/dGTt6Zs ).   Mais, par le jeu des amendements déposés par les parlementaires (qui sont eux-mêmes sollicités par des porteurs d'intérêt, ce qui est le jeu normal de la démocratie), il est devenu possibledans l'article final de revendiquer la neutralité d'un produit ""sous certaines conditions"", précisées par décret.  Ce qu'explique cet article de Carbone 4, c'est que le décret tout juste pris rend les conditions en question très faciles à satisfaire, et vont donc permettre à qui le veut - y compris un exploitant de centrales à charbon ou un vendeur de carburants - de revendiquer la neutralité de son produit ou service.   Comme le dit  cet article en conclusion, nous venons en pratique de permettre ""l’émergence d’un monde à +4°C peuplé de produits et services neutres”. L'étape suivante sera-t-elle l'ouverture en France d'une ESG - ""école supérieure du greenwashing"" - pour apprendre à bien mettre ces dispositions en oeuvre ?         ",426,4.0
Jean-Marc Jancovici,"C'est un fait bien connu sur lequel revient Laura Foglia (cheffe de projet ""mobilité du quotidien"" pour le plan de transformation de l'économie française) dans cette interview pour Novethic : la voiture pour tou(te)s ou presque (il y a désormais 40 millions de véhicules particuliers dans notre pays contre 2,5 juste après guerre) a conduit à faire un urbanisme étalé en conséquence.  Nous n'avons donc pas affecté l'augmentation de la vitesse des déplacements à raccourcir nos temps de déplacement, mais à allonger les distances à temps de déplacement constant.  Question : que deviendra cet urbanisme lorsque, Poutine ou pas, nous aurons de moins en moins de modes de déplacement individuels rapides ? Car ce temps viendra : il n'y aura pas 1,2 milliard de voitures particulières (valeur actuelle) électriques sur terre pendant des siècles (condition pour que l'urbanisme, dont le temps d'évolution est plus proche du siècle que de l'année, évolue).  Une autre question vient se greffer : sachant que les villes sont uniquement des lieux d'échange ou de transformation, où rien ""de base"" n'est produit sur place (ni mines, ni champs, ni forêts...), avec des emplois associés (essentiellement du tertiaire), que deviendront les villes quand les transports longue distance qui permettent de nourrir les habitants, les vêtir, les loger, et acheminer tout ce qui est nécessaire aux emplois tertiaires en question, deviendront moins abondants ? A l'époque de l'énergie rare (il y a quelques siècles) la population urbaine était considérablement plus petite qu'aujourd'hui... et ce n'est pas un hasard.  Là comme ailleurs, moins nous anticiperons - ce qui est le cas actuel - et plus dure sera la régulation par la crise. Entre autres absences dans les débats de cette drôle de campagne, aucun(e) candidat(e) n'a dit quoi que ce soit sur la manière de faire évoluer l'aménagement du territoire - proportion villes/campagnes et forme des villes - dans un monde plus sobre en énergie.  Ne pas en rajouter au problème (et donc arrêter de faire grossir les grosses villes + contenir l'étalement urbain de celles existantes) devrait être la première étape de ce difficile chemin.         ",437,4.0
Jean-Marc Jancovici,"Le GIEC - IPCC en anglais - vient de publier le 3è volet de son 6è rapport d'évaluation (ca fait un peu série à rebondissements :) : https://lnkd.in/ee43XibU  Rappelons que les 3 ""volets"" d'un rapport d'évaluation concernent le fonctionnement du système climatique sur le plan physique et sa modification sous l'influence des activités humaines (groupe 1), les impacts de cette modification sur les écosystèmes et les sociétés humaines (groupe 2), et enfin les moyens d'action (groupe 3).  Le GIEC a une particularité : il se doit d'être ""policy relevant"" (donc fournir des éléments permettant d'éclairer la prise de décision) mais pas ""policy prescriptive"" (il n'a donc pas à recommander des politiques publiques, contrairement à ce que suggèrent nombre de commentaires - erronés - déjà lus dans la presse).   Cette partie de son mandat est très facile à respecter pour le groupe 1 (la physique est régie par des lois qui ne dépendent pas de nos valeurs morales ou conventions), assez facile pour le groupe 2 (les impacts dépendent peu de nos valeurs morales ou conventions, même si dans les mesures d'adaptation on va trouver des conventions ou préférences qui interviennent), mais... presque impossible pour une large partie de ce qui concerne le groupe 3.  En effet, c'est dans ce groupe que l'on trouve l'apport de l'économie à la possible manière de résoudre le problème. Or, parler d'économie, c'est avoir par définition choisi une convention qui tient les ressources pour sans valeur (rappelons que les prix n'intègrent pas, par définition, le ""cout de la nature"" : https://lnkd.in/gPsGK-F ).   Eclairer un choix sur la préservation d'un actif naturel avec des indicateurs qui tiennent la valeur de cet actif pour nul est déjà un pari osé. Mais, en plus, il n'existe pas de prix sans marché. Parler systématiquement prix est donc ilmplicitement supposer que l'économie de marché généralisée est compatible avec le ""sauvetage du climat"", alors que la norme et la réglementation - qui ne créent pas de prix explicites - sont d'autres moyens d'orienter nos choix. C'est très proche de la prescription que de ne parler que des instruments de marché...   La raison à cela ? Les modèles utilisés par les économistes ne savent pas bien - voire pas du tout - explorer un avenir uniquement modifié par des règlements. Mais qui comprendra que de ne pas parler des règlements vient d'une limite sur les outils des économistes universitaires et non d'une impossibilité de s'en servir dans la vraie vie ?  Autre exemple : tous les scénarios d'émission limitant fortement le réchauffement comportent un PIB mondial qui croit d'ici à 2100, tout simplement parce que... le PIB a été postulé croissant au départ. Qui comprendra que c'est une hypothèse non démontrée et non une conclusion ?  Ce nouveau rapport demande donc beaucoup de recul pour sa lecture sur la partie ""solutions"". Sinon gare aux désillusions...         ",438,3.0
Jean-Marc Jancovici,"Dernière chronique du Samedi matin sur RTL avant le premier tour. Elle part du dernier rapport du GIEC, celui du groupe 3, qui porte sur les marges de manoeuvre.   Ce rapport est par nature bien plus délicat à interpréter que les groupes 1 et 2. Reprenons du début : un rapport du GIEC part toujours de ce qui a été publié dans les revues à comité de lecture des disciplines couvertes. Pourle groupe 3, il s'agit très souvent d'économie.  Conséquence logique : la synthèse du groupe 3 ""incorpore"" donc - mais sans le rappeler - les limites de l'économie en général. Cette discipline s'appuie avant tout sur des conventions humaines, ou sur des scénarios qui partent d'hypothèses postulées et non démontrées.  Première limite : parler prix est par définition supposer l'existence d'un marché (c'est tellement évident ; on l'oublie souvent !). Mais tout n'est pas marchand dans nos sociétés. Pour revenir à l'actualité du jour, le droit de vote n'a pas de valeur marchande, or l'avoir ou pas change un peu l'avenir...  Après il y a des limites qui viennent non pas des outils utilisés mais de nos ""oeillères"" culturelles. Par exemple je ne connais pas de simulations économiques qui explorent une productivité qui décroit à peu près comme les émissions (parce que les émissions c'est de l'énergie, l'énergie c'est des machines, et ce qui a augmenté la productivité ce sont les machines !). Du coup la productivité augmente par hypothèse dans tous les travaux économiques, et en conséquence les marges de manoeuvre techniques sont systématiquement ""de moins en moins chères"". Est-ce si sur ?  L'économie théorique prend toujours le PIB (ou la productivité du travail et la population, ce qui revient au même) comme donnée d'entrée des modèles et non comme donnée de sortie. Comme la croissance est désirable (!), le PIB est supposé croissant, et ""appelle"" des ressources conventionnellement disponibles.   Impossible de voir venir les limites physiques à la production - qui existent pourtant - avec un tel raisonnement !  Cela explique pourquoi on trouve p. 27 du résumé pour décideur - https://lnkd.in/e_6VyaAy - l'hypothèse que le PIB croit sans discontinuer jusqu'en 2100 quel que soit le scénario d'émission :).  Avant la publication de ce rapport, The Shift Project a envoyé au GIEC une remarque pour souligner que :  - les scénarios hauts (SSP 8.5 voire 7.0 ; https://lnkd.in/ehJGzTmi ) supposent une disponibilité en combustibles fossiles qui pose question.   - les scénarios bas (SSP 2.6 et SSP 1.9) supposent un découplage entre émissions et PIB - et donc un découplage entre émissions et productivité du travail - qui pose aussi question.  Rappelons que le GIEC a pour mandat d'informer mais non de prescrire l'action (en anglais on dit ""policy relevant but not policy prescriptive""). Mais l'économie ne permet pas de bien faire la différence. Est-ce ne pas être ""prescriptif pour l'action"" quand on écrit que toute marge de manoeuvre peut s'inscrire dans un avenir en croissance ?         ",439,3.0
Jean-Marc Jancovici,"Le Plan de transformation de l'économie française (PTEF) a été mis à la question au sens propre du terme par les étudiant(e)s de l'Institut Agro Rennes-Angers, qui m'ont ""passé sur le gril"" sur divers chapitres de ce travail.  Plutôt que de faire une conférence ""classique"" dont il existe déjà N versions enregistrées sur Youtube (https://lnkd.in/egH_JQ6R ), j'ai proposé à mes interlocuteurs de faire la chose suivante : commencer par regarder une des vidéos en question, puis consacrer l'intégralité du temps passé avec votre serviteur à un échange autour des questions nées du visionnage.  Là, l'idée a été de structurer toutes les questions - posées par des étudiantes (pas assez alors que l'agro est aux 2/3 féminine...) et des étudiants - autour des chapitres du PTEF. J'espère que l'exercice aura intéressé l'auditoire, en tous cas il aura au moins eu le mérite de m'éviter de répéter tout le temps la même chose !         ",440,3.0
Jean-Marc Jancovici,"Solution miracle pour les uns, fausse bonne idée pour les autres, la voiture électrique se retrouve désormais souvent au centre de débats passionnés sur la place qu'elle doit occuper pour remplacer ces satanées voitures à pétrole qui puent et qui polluent.  A travers une première série de questions-réponses, Carbone 4 vous propose de faire un état des lieux sur l'aspect ""carbone"" de l'affaire, pour vous aider à situer la voiture électrique par rapport à ses alternatives (dont la voiture hybride), et vous aider aussi à comprendre que même au sein de l'électrique il y a plus ou moins vertueux en matière de carbone selon que l'on a une petite voiture ou un e-tank.  Bonne lecture !         ",441,2.0
